<!--root element: student-database
the student-database container must contain one more more students.-->
<!ELEMENT student-database (student)+>
<!--A student must contain 0 or 1 middle name, a last name,0 or 1 preferred name, a student ID, one contact information element, and one student enrollment element
 each contact-information element must have one email and one phone number for the student
 each student identification element can only have one student id number attached to it-->
<!ELEMENT student(middle-name?,last-name,preferred-name?,student-identification,contact-information,student-enrollment)>
<!ELEMENT middle-name        (#PCDATA)>
<!ELEMENT last-name          (#PCDATA)>
<!ELEMENT preferred-name     (#PCDATA)>
<!ELEMENT contact-information (email,phone-number)>
<!ELEMENT student-identification(number)>
<!--Each student-enrollment element must have the following pieces of information about the student major, minor, gpa
advisor, year, date of enrollment, and graduation date. one of each, except major and advisors(in the case that the student is a double major with more than one advisor)-->
<!ELEMENT student-enrollment (major+,minor,gpa,advisor+,year,date,graduation-date)>
<!ELEMENT major              (#PCDATA)>
<!ELEMENT minor              (#PCDATA)>
<!ELEMENT gpa                (#PCDATA)>
<!ELEMENT date               (#PCDATA)>
<!ELEMENT graduation-date    (#PCDATA)>
<!ELEMENT advisor            (#PCDATA)>
<!ELEMENT phone-number       (#PCDATA)>
<!ELEMENT email              (#PCDATA)>
<!ELEMENT year               (#PCDATA)>



<!--number is an attribute of the student identification element. It is required that it takes character data
status is an attribute of the student-enrollment element. It is required that the value of that attribute is either full-time, part-time, withdrawn, or graudated-->
<!ATTLIST student-identification
          number CDATA #REQUIRED>
<!ATTLIST student-enrollment
          status(full-time| part-time|graduated|withdrawn) #REQUIRED>
<!ATTLIST student
          name CDATA #REQUIRED>
